id,name,type,whoUsesIt,privacy,security,aiFeatures,platforms,uniqueStrength,summary,logo,website,newcomer
oasis,Oasis Enterprise,Enterprise,All business functions,"Configurable privacy controls tailored to organizational needs",Enterprise-grade,Built into the core,"Windows, macOS",Elegant and ergonomic user experience,Perfect for enterprises of all kinds,
perplexitycomet,Chrome,Consumer,General consumers,"Basic protections, tracks user data","Frequent updates, site isolation","Google AI (search, autofill, smart suggestions)",All major OS,"Speed, extension ecosystem, widespread use","Most widely used; best for general use & Google services",
safari,Safari,Consumer,Apple device users,"Strong privacy, tracking prevention","Apple sandboxing, regular security","Limited (Siri, iOS Focus features)","macOS, iOS","Private by default, Apple ecosystem integration","Best for Apple ecosystem and privacy-conscious iOS/macOS users",
edge,Edge,Consumer,"Windows, Microsoft ecosystem","Tracking prevention, integrated privacy","Chromium core, phishing protection","Microsoft Copilot, Bing AI",All major OS,"AI integration, default on Windows","Best AI-integrated browser & Microsoft 365",
firefox,Firefox,Consumer,"Privacy-conscious users, open-source advocates","Strong privacy, little data collection","Best-in-class updates, sandboxing",None,All major OS,"Customizable, privacy-focused","Best open-source and customizable browser",
brave,Brave,Consumer,"Privacy-first, ad-block fans","Built-in tracker/ad blocker, privacy lead","Frequent privacy/security updates",None,All major OS,"Aggressive tracker & ad blocking","Best browser for privacy and ad-free experience",
samsungInternet,Samsung Internet,Consumer,Android (Samsung) users,"Basic controls, pre-installed privacy","Frequent Android security patches",None,Android only,"Optimized for Samsung devices, simple privacy","Best for Samsung Android users (default browser)",
opera,Opera,Consumer,Niche/power users,"Built-in VPN, ad blocker",Regular updates,Aria AI assistant,All major OS,"Unique free VPN and privacy features","Best for casual users who want built-in VPN & extra features",
dia,Dia Browser,Consumer,"Minimalists, security",Lightweight privacy settings,"Minimal attack surface, secure browsing",None,"Win, macOS, Linux","Clean design, focus on simplicity","Simple, secure, best for minimalist needs",
genspark,Genspark,Consumer,"AI and productivity fans","Privacy-focused, open-source","Secure browsing, prompt security",On-device AI assistant,"Win, macOS, Chrome extensions","Full privacy plus integrated open-source AI","Great for privacy/AI fans",
perplexitycomet2,Perplexity Comet,Consumer,AI search fans,"AI-privacy, session controls","AI-driven threat detection","Purpose-built agentic AI/GenAI","Win, macOS, browser","Conversational search and agentic GenAI","For next-gen agentic browser fans",
here,Here Enterprise Browser,Enterprise,Large enterprises,"Zero-trust, no tracking, unified data management","Enterprise-grade, containerization, unified policies","Productivity AI, Supertabs","Win, macOS, web","Combines security with unified productivity workspace","Reduces toggle tax; best for complex org workflows",
mammoth,Mammoth Browser,Enterprise,Cybersecurity-focused IT,"Minimizes data exposure, secure access","Secure enterprise browser, threat isolation","Workflow automation, integration","Win, macOS, Linux","Secure unified access, patented workspace features","Emphasizes context reduction for high security needs",
kasm,Kasm Workspaces,Enterprise,IT teams,"Isolates sessions; minimal persistence","Containerization, VDI replacement","App/file isolation, workflow optimization","Win, macOS, Linux, browser","App/file containers for workflow and security","Great for enterprise VDI reduction, toggling minimized",
microsoft,Microsoft Edge Workspaces,Consumer,Knowledge workers,"MS tracking prevention, corporate visibility","Site isolation, phishing protection","Copilot AI, workflow unification",All major OS,"Integrates MS productivity and project info","Minimizes context switching via unified tabs",
netzilo,Netzilo Enterprise Browser,Enterprise,Regulated sectors,"Zero-trust, granular data controls","Compliance ready, strong access policies",Secure integrations,"Win, macOS, Linux","Lightweight, reduces VDI complexity, compliance","Best for regulated VDI and split-screen workflows",
zoho,Zoho Ulaa Enterprise Browser,Enterprise,SMB and collaboration,"App/data integration, privacy modes","Containerized app switching, strong policies","Custom productivity integrations","Win, macOS, Linux, Android, iOS","Integrated search and action across apps/files","Reduces app toggling; ideal for SMB collaboration",
prisma,Prisma Access Browser,Enterprise,"Corporates, large orgs","Policy-driven privacy, compliance centered","Threat emulation, protocol enforcement",Unified workspace AI,"Win, macOS, Linux, browser","Centralizes SaaS tools and compliance management","Secure, toggle-free unified SaaS workflows",
shift,Shift Browser,Consumer,"Power users, freelancers","Unified login management, email privacy","App sandboxing, frequent patching","AI task management, productivity extensions","Win, macOS","App unification for communications and management","Excels at multi-account, ""toggle tax"" reduction",
workona,Workona,Consumer,"Teams, organizers","Workspace privacy options, sync controls",Workspace sandboxing,Productivity extensions,"Win, macOS, Linux, web","Tab/split context management, context persistence","Best for workspace managers and tab overload",
rambox,Rambox,Consumer,Open-source advocates,"Workspace privacy, open standards","Frequent updates, sandboxing",None,All major OS,"App aggregation/custom layout, open-source features","Workspace aggregator for multitasking",
arthur,Arthur,Enterprise,VR/AR orgs,"User visualization control, spatial privacy","Secure session, VR identity isolation","AI workspaces, virtual monitors","Win, macOS, VR platforms","Multi-monitor VR workspace for focus and engagement","Boosts productivity, great for immersive environments",
dimension10,Dimension10,Enterprise,"Architecture, engineers","File/model privacy, session limits","BIM model protection, interactivity security",3D model workflows,"Win, VR platforms","VR whiteboard and BIM model interface","Reduces 3D context switching for build/design",
arborxr,ArborXR,Enterprise,XR device operators,"Device-level privacy, centralized control","Multi-device security, app gating",Device management AI,"Win, macOS, VR/AR devices","XR device fleet management, workflow centralization","Best for enterprise XR device deployments",
meta,Meta Horizon Workrooms,Consumer,VR collaborators,"Collaboration privacy, guest/session controls","VR session isolation, audit logs","Integrates Slack, Figma, Zoom in VR","Meta VR platforms, Win, macOS","VR meeting and productivity in unified space","Great for remote VR teams and creators",
nreal,Nreal/Xreal,Consumer,AR glasses users,"On-device privacy, app isolation","Device-integrated security, AR safeguards",AR workspace AI,"AR glasses, Win, macOS","Unified app navigation in spatial AR environments","Best for device-switching fatigue reduction",
varjo,Varjo,Enterprise,"CAD, aviation, engineers","AI-powered privacy, spatial data control","VR session security, industrial-grade protection","CAD/analytics/communication integration","Win, macOS, VR platforms","Integrated VR workflows for industrial professionals","Reduces design iteration; excellent enterprise value",
layerx,LayerX,Enterprise,"SaaS, zero-trust orgs","Agentless privacy for SaaS, GenAI workflows","Zero trust app/file access, AI threat prevention","SaaS and GenAI workflow AI","Win, macOS, Linux, Cloud","Seamless SaaS security and unified workspace","Security-focused, reduces toggle tax, high productivity",
talon,Talon Cyber Security,Enterprise,Security-driven orgs,Zero-trust browser control,"Threat protection for unmanaged devices",Secure integrations,"Win, macOS, Linux, browser","Reduces app switching securely, workspace persistence","Best for zero-trust organizations",
checkpoint,Check Point Harmony Browse,Enterprise,Security-sensitive firms,"Threat emulation, enhanced privacy controls","Threat prevention, URL filtering",Security-focused AI,"Win, macOS, Linux, browser","Minimal productivity impact, robust threat mitigation","Security-first, potential for unified workspace",,
zen,Zen Browser,Consumer,"Productivity-focused users, privacy-conscious","Privacy-focused, minimal data collection","Free and open-source, community maintained",None,"Win, macOS, Linux","Workspaces, Compact Mode, Glance, Split View","Beautifully designed, privacy-focused browser. Workspaces, compact mode, split view. Free and open-source.",https://zen-browser.app/,yes
strawberry,Strawberry,Consumer,"Sales, recruiting, operations, research","AI-privacy, session controls","AI-driven threat detection","Purpose-built agentic AI automation in tabs","macOS, Windows","Self-driving browser for workflow automation","Intuitive AI automation in your tabs. Automates Sales Navigator, Salesforce, Gmail, recruiting, research. Raised $5M, #1 Product Hunt.",https://strawberrybrowser.com/,yes
sigmaos,SigmaOS,Consumer,"Students, founders, researchers, creators","Strong privacy, Intelligent Tracking Protection","WebKit, Apple Keychain, sandboxing","Airis AI assistant, A1 Kit engine, Lazy Search","macOS (Windows coming)","Workspaces, vertical tabs, split screen, Simplify","WebKit-based. Airis chats with any website. Workspaces, vertical tabs, tasks-as-done. Free + Pro $20/mo.",https://sigmaos.com/,yes
moonshot,Moonshot AI,Consumer,"AI and productivity users",TBD,TBD,AI/LLM capabilities,TBD,"AI company with browser ambitions","Major AI company; browser product to watch",https://www.moonshot.ai/,yes
